"gameId","gameName","alternateNames","subcategory","level","description","playersMax","ageRange","duration","equipmentNeeded","objective","skillsDeveloped","setupTime","place","physicalIntensityLevel","educationalBenefits","category"
"285","Luta de Galo","Rooster Fight","Traditional Game","Beginner","A Brazilian game where players hold one leg and try to knock off a handkerchief tucked in the opponent's belt.","2+","8+","Variable","Handkerchiefs or cloths","Capture the opponent's handkerchief while hopping on one leg.","Balance; Agility; Strategy","2 minutes","Open space","Moderate","Improves balance and coordination","Traditional and Cultural Games"
"286","Kabaddi (India)","None","Traditional Sport","Beginner to Professional","A contact team sport originating from India, where a 'raider' enters the opposing team's half to tag as many defenders as possible and return to their own half without being tackled.","14","7+","40 minutes","No equipment (sometimes a marked court)","Score points by tagging opponents and returning safely.","Agility; Strategy; Breath control","5 minutes","Kabaddi court","High","Enhances physical fitness, strategic thinking, and teamwork","Traditional and Cultural Games"
"287","Sepak Takraw (Malaysia)","Kick Volleyball","Traditional Sport","Intermediate to Professional","A sport popular in Southeast Asia where players hit a rattan ball over a net using their feet, knees, chest, and head.","6","10+","15-30 minutes","Sepak takraw ball; Net","Score points by grounding the ball on the opponent's side without using hands.","Flexibility; Agility; Coordination","5 minutes","Court similar to badminton","High","Improves agility, coordination, and cultural appreciation","Traditional and Cultural Games"
"288","Go (China)","Weiqi; Baduk","Board Game","Beginner to Master","An abstract strategy board game from China involving two players who alternately place black and white stones on a grid.","2","8+","30 minutes to several hours","Go board; Black and white stones","Control more territory on the board than your opponent.","Strategic thinking; Patience; Spatial reasoning","5 minutes","Tabletop","Low","Enhances strategic thinking and concentration","Traditional and Cultural Games"
"289","Pachisi (India)","Ludo; Parcheesi","Board Game","Beginner","A traditional Indian board game where players race their pieces around the board based on dice rolls.","4","6+","30-60 minutes","Pachisi board; Pawns; Dice or cowrie shells","Be the first to get all your pieces to the home square.","Counting; Strategy; Probability","5 minutes","Tabletop","Low","Develops counting skills and strategic planning","Traditional and Cultural Games"
"290","Mancala (Africa)","Oware; Bao","Board Game","Beginner to Intermediate","A family of board games played around the world, involving moving stones or seeds around a board with pits.","2","6+","15-30 minutes","Mancala board; Stones or seeds","Capture more stones than your opponent.","Counting; Strategy; Planning","2 minutes","Tabletop","Low","Improves counting skills and strategic thinking","Traditional and Cultural Games"
"291","Hnefatafl (Norway)","Viking Chess","Board Game","Beginner to Intermediate","An ancient Scandinavian board game of strategy, involving a king's escape from attackers.","2","8+","20-30 minutes","Hnefatafl board; Playing pieces","Defenders aim to help the king escape; attackers aim to capture the king.","Strategic planning; Tactical thinking","5 minutes","Tabletop","Low","Enhances strategic thinking and historical appreciation","Traditional and Cultural Games"
"292","Xiangqi (China)","Chinese Chess","Board Game","Beginner to Advanced","A two-player strategy board game similar to Western chess, popular in China.","2","6+","30-60 minutes","Xiangqi board; Playing pieces","Checkmate the opponent's general (king).","Strategic thinking; Concentration; Planning","5 minutes","Tabletop","Low","Develops strategic thinking and cultural knowledge","Traditional and Cultural Games"
"293","Shogi (Japan)","Japanese Chess","Board Game","Beginner to Advanced","A two-player strategy board game native to Japan, similar to chess but with unique rules like piece promotion.","2","6+","30-90 minutes","Shogi board; Playing pieces","Checkmate the opponent's king.","Strategic thinking; Memory; Adaptability","5 minutes","Tabletop","Low","Enhances strategic planning and cultural appreciation","Traditional and Cultural Games"
"294","Petanque (France)","Boules","Outdoor Game","Beginner to Advanced","A game originating from France where players throw hollow metal balls towards a small wooden target ball.","6","7+","30-60 minutes","Metal balls (boules); Target ball (cochonnet)","Score points by having your boules closest to the target ball.","Precision; Strategy; Coordination","5 minutes","Gravel or hard dirt surface","Low","Develops precision and social interaction","Traditional and Cultural Games"
"295","Capoeira (Brazil)","None","Martial Art/Dance","Beginner to Advanced","An Afro-Brazilian martial art combining elements of dance, acrobatics, and music.","Unlimited","10+","Variable","Traditional instruments (berimbau, drums); Comfortable clothing","Engage in a flow of movements with a partner, emphasizing skill and expression.","Flexibility; Rhythm; Cultural expression","10 minutes","Open space","Moderate to High","Enhances physical fitness, rhythm, and cultural understanding","Traditional and Cultural Games"
"296","Kho Kho (India)","None","Traditional Sport","Beginner to Intermediate","A traditional Indian tag game where one team chases and tries to tag the members of the opposing team.","12","7+","9 minutes per inning","Marked Kho Kho court","Score points by tagging as many opponents as possible.","Speed; Strategy; Teamwork","5 minutes","Kho Kho field","High","Improves physical fitness, teamwork, and strategic planning","Traditional and Cultural Games"
"297","Jianzi (China)","Shuttlecock Kick","Traditional Sport","Beginner to Intermediate","A Chinese game where players keep a weighted shuttlecock in the air using their feet and body, without hands.","Unlimited","6+","Variable","Jianzi (shuttlecock)","Keep the shuttlecock in the air as long as possible.","Coordination; Agility; Balance","2 minutes","Open space","Moderate","Enhances coordination and physical fitness","Traditional and Cultural Games"
"298","Ulama (Mexico)","Mesoamerican Ballgame","Traditional Sport","Intermediate","An ancient ballgame from Mesoamerica played with a rubber ball, where players hit the ball using their hips.","12","12+","Variable","Rubber ball; Ulama court","Keep the ball in play and score points against the opposing team.","Endurance; Agility; Teamwork","10 minutes","Specialized court","High","Promotes physical fitness and cultural heritage awareness","Traditional and Cultural Games"
"299","Maori Stick Game (New Zealand)","Ti Rakau","Cultural Game","Beginner","A traditional New Zealand Maori game involving rhythmic passing and catching of sticks in patterns.","Unlimited","6+","Variable","Short sticks or dowels","Coordinate stick movements with partners in rhythm.","Rhythm; Coordination; Teamwork","5 minutes","Open space","Low","Enhances coordination and cultural appreciation","Traditional and Cultural Games"
"300","Pilolo (Ghana)","None","Children's Game","Beginner","A traditional Ghanaian game where objects are hidden, and players race to find them upon a signal.","Unlimited","5+","Variable","Small objects (stones, sticks)","Find the hidden object and reach the finish line first.","Speed; Observation; Agility","5 minutes","Open area","Moderate","Develops observation skills and physical fitness","Traditional and Cultural Games"
"301","Buzkashi (Afghanistan)","None","Traditional Sport","Advanced","A Central Asian sport where horseback players try to place a goat or calf carcass in a goal.","Unlimited (usually two teams)","16+","Variable","Horses; Goat or calf carcass","Score by placing the carcass in the goal area.","Riding skills; Strength; Strategy","15 minutes","Large open field","High","Enhances horsemanship and cultural understanding","Traditional and Cultural Games"
"302","Gonggi (South Korea)","Korean Jacks","Traditional Game","Beginner","A Korean children's game played with five small stones, involving various throwing and catching sequences.","1+","5+","Variable","Five small stones or plastic pieces","Complete a series of skillful maneuvers with the stones.","Dexterity; Coordination; Concentration","None","Floor space","Low","Develops fine motor skills and concentration","Traditional and Cultural Games"
"303","Luta de Galo (Brazil)","Rooster Fight","Traditional Game","Beginner","A Brazilian game where players hold one leg and try to knock off a handkerchief tucked in the opponent's belt.","2+","8+","Variable","Handkerchiefs or cloths","Capture the opponent's handkerchief while hopping on one leg.","Balance; Agility; Strategy","2 minutes","Open space","Moderate","Improves balance and coordination","Traditional and Cultural Games"
"304","Mahjong (China)","None","Board Game","Intermediate to Advanced","A tile-based game originating from China, played with a set of 144 tiles based on Chinese characters and symbols.","4","12+","1-2 hours","Mahjong tiles; Scoring sticks or chips","Be the first to complete a legal hand by drawing and discarding tiles.","Pattern recognition; Strategy; Memory","10 minutes","Tabletop","Low","Enhances memory, strategic thinking, and cultural appreciation","Traditional and Cultural Games"
"305","Dara (Nigeria)","None","Board Game","Beginner to Intermediate","A two-player abstract strategy game from West Africa, played on a 5x6 grid with stones or tokens.","2","8+","15-30 minutes","Game board (5x6 grid); 12 stones or tokens per player","Align three of your stones in a row to remove an opponent's stone; reduce opponent to two stones to win.","Strategic thinking; Planning; Concentration","2 minutes","Tabletop","Low","Develops strategic planning and cultural knowledge","Traditional and Cultural Games"
"306","Bocce (Italy)","Bocci; Boules","Outdoor Game","Beginner to Advanced","An Italian bowling game where players throw balls to get closest to a smaller target ball called the pallino.","8","7+","30-60 minutes","Bocce balls; Pallino (small target ball)","Score points by having your balls closer to the pallino than your opponent's.","Precision; Strategy; Coordination","5 minutes","Grass or sand court","Low","Enhances precision, coordination, and social interaction","Traditional and Cultural Games"
"307","Kubb (Sweden)","Viking Chess","Outdoor Game","Beginner to Intermediate","A lawn game where players throw wooden batons to knock down the opponent's wooden blocks (kubbs), ultimately aiming to knock over the king.","12","5+","30-60 minutes","Wooden kubbs; Batons; King piece","Knock down all opponent's kubbs and then the king to win.","Throwing accuracy; Strategy; Teamwork","5 minutes","Grass or flat surface","Low to Moderate","Develops coordination, strategy, and teamwork","Traditional and Cultural Games"
"308","Stickball (Native American)","None","Traditional Sport","Intermediate","A team sport played by Native American tribes, using sticks with small nets to pass a ball and score goals.","Unlimited","10+","Variable","Stickball sticks (sticks with nets); Ball","Score points by getting the ball into the opponent's goal.","Agility; Teamwork; Coordination","10 minutes","Field or open area","High","Promotes physical fitness and cultural heritage appreciation","Traditional and Cultural Games"
"309","Chunkey (Native American)","Chunky","Traditional Game","Beginner to Intermediate","An ancient game played by Native American tribes involving rolling a disc-shaped stone and throwing spears where they think it will stop.","Unlimited","10+","Variable","Chunkey stone (disc-shaped); Spears or sticks","Predict where the stone will stop and throw your spear accordingly.","Hand-eye coordination; Prediction; Strategy","5 minutes","Open area","Moderate","Enhances coordination, strategic thinking, and cultural understanding","Traditional and Cultural Games"
"310","Capture the Flag","None","Outdoor Game","Beginner to Intermediate","Two teams each have a flag and try to capture the opponent's flag and bring it to their own base without being tagged.","Unlimited","6+","Variable","Flags or markers","Capture the opposing team's flag without being tagged.","Teamwork; Strategy; Agility","5 minutes","Large open area","High","Enhances teamwork, strategic planning, and physical fitness","Physical Fitness Games"
"311","Relay Races","None","Running Game","Beginner","Teams compete in races where each member runs a segment before passing a baton to the next runner.","Unlimited","4+","Variable","Baton or any handheld object","Be the first team to have all members complete their segments.","Speed; Teamwork; Coordination","2 minutes","Track or open space","High","Improves speed, teamwork, and coordination","Physical Fitness Games"
"312","Obstacle Course Challenge","None","Physical Activity","Intermediate","Participants navigate a series of physical obstacles designed to challenge strength, agility, and endurance.","Unlimited","6+","Variable","Variety of equipment (cones, ropes, hurdles)","Complete the course in the fastest time or with the best technique.","Strength; Agility; Problem-solving","15-30 minutes","Open area","High","Enhances physical fitness and problem-solving skills","Physical Fitness Games"
"313","Dodgeball","None","Ball Game","Beginner","Players try to eliminate opponents by hitting them with soft balls while avoiding being hit themselves.","Unlimited","8+","Variable","Soft balls; Marked boundaries","Eliminate all players on the opposing team.","Agility; Throwing accuracy; Reflexes","5 minutes","Gym or open space","High","Improves agility, coordination, and teamwork","Physical Fitness Games"
"314","Jump Rope Challenges","None","Cardio Exercise","Beginner to Intermediate","Players perform various jump rope exercises, sometimes incorporating tricks or speed challenges.","Unlimited","5+","Variable","Jump ropes","Complete jump rope activities or challenges.","Endurance; Coordination; Rhythm","2 minutes","Open space","Moderate to High","Enhances cardiovascular fitness and coordination","Physical Fitness Games"
"315","Musical Fitness Circuit","None","Fitness Game","Beginner","Participants move through fitness stations set to music, performing different exercises at each station.","Unlimited","6+","Variable","Music source; Exercise equipment (optional)","Complete all fitness stations while enjoying music.","Strength; Endurance; Flexibility","10 minutes","Gym or open area","High","Promotes physical fitness and makes exercise enjoyable","Physical Fitness Games"
"316","Tag Variations","Freeze Tag; Shadow Tag","Running Game","Beginner","Various forms of tag where players chase and tag others, sometimes with additional rules like freezing in place when tagged.","Unlimited","4+","Variable","None","Avoid being tagged or tag other players based on game variation.","Speed; Agility; Strategy","None","Open area","High","Encourages physical activity and quick reflexes","Physical Fitness Games"
"317","Simon Says Fitness Edition","None","Instructional Game","Beginner","A fitness twist on Simon Says where players perform exercises only when 'Simon says.'","Unlimited","4+","Variable","None","Follow the commands starting with 'Simon says' to stay in the game.","Listening; Physical fitness; Coordination","None","Open space","Moderate","Combines listening skills with physical exercise","Physical Fitness Games"
"318","Fitness Scavenger Hunt","None","Team Activity","Beginner to Intermediate","Teams search for items or complete fitness challenges based on clues provided.","Unlimited","6+","Variable","Clue cards; List of items or challenges","Be the first team to find all items or complete all challenges.","Teamwork; Problem-solving; Physical fitness","15 minutes","Various locations","Moderate","Promotes teamwork, problem-solving, and physical activity","Physical Fitness Games"
"319","Yoga Freeze","None","Balance Game","Beginner","Players perform yoga poses when music stops, holding the pose without moving.","Unlimited","4+","Variable","Music source","Hold the yoga pose without losing balance when the music stops.","Balance; Flexibility; Concentration","2 minutes","Open space","Low to Moderate","Improves balance, flexibility, and mindfulness","Physical Fitness Games"
"320","Tug of War","None","Strength Game","Beginner","Two teams pull on opposite ends of a rope, trying to drag the other team across a center line.","Unlimited","6+","Variable","Sturdy rope; Marked center line","Pull the opposing team across the center line.","Strength; Teamwork; Coordination","5 minutes","Flat surface","High","Builds strength and encourages teamwork","Physical Fitness Games"
"321","Hula Hoop Challenges","None","Coordination Game","Beginner","Participants perform various activities using hula hoops, such as keeping it spinning around the waist or using it in relay races.","Unlimited","4+","Variable","Hula hoops","Complete hula hoop challenges individually or as a team.","Coordination; Endurance; Rhythm","2 minutes","Open space","Moderate","Enhances coordination and cardiovascular fitness","Physical Fitness Games"
"322","Red Light, Green Light Fitness Edition","None","Movement Game","Beginner","Players perform exercises while 'green light' is called and freeze when 'red light' is called.","Unlimited","4+","Variable","None","Reach the caller first by performing exercises correctly and stopping promptly.","Self-control; Agility; Listening","None","Open area","Moderate","Combines physical fitness with listening skills","Physical Fitness Games"
"323","Balloon Volleyball","None","Team Game","Beginner","Teams volley a balloon over a net or line, trying to prevent it from touching the ground on their side.","Unlimited","4+","Variable","Balloons; String or net","Keep the balloon in play and land it on the opponent's side.","Coordination; Teamwork; Reflexes","5 minutes","Open space","Low to Moderate","Improves coordination and encourages teamwork","Physical Fitness Games"
"324","Animal Races","None","Movement Game","Beginner","Participants race while imitating different animal movements, such as crab walks or bear crawls.","Unlimited","4+","Variable","None","Reach the finish line first while moving like the designated animal.","Strength; Coordination; Flexibility","2 minutes","Open area","High","Enhances physical fitness and makes exercise fun","Physical Fitness Games"
"325","Fitness Dice","None","Exercise Game","Beginner","Participants roll dice that determine different exercises and repetitions to perform.","Unlimited","6+","Variable","Customized dice with exercises and numbers","Perform the exercises shown on the dice after each roll.","Strength; Endurance; Flexibility","2 minutes","Open space","Moderate to High","Introduces variety in workouts and keeps participants engaged","Physical Fitness Games"
"326","Steal the Bacon","None","Running Game","Beginner","Two teams line up opposite each other and try to grab an object ('the bacon') and return it to their side without being tagged.","Unlimited","6+","Variable","Object to serve as 'bacon' (e.g., beanbag)","Retrieve the object and return safely without being tagged.","Speed; Agility; Strategy","5 minutes","Open area","High","Improves speed, agility, and strategic thinking","Physical Fitness Games"
"327","Jumping Jacks Challenge","None","Cardio Exercise","Beginner","Participants perform jumping jacks for as long as they can or in timed intervals, sometimes incorporating variations.","Unlimited","5+","Variable","None","Complete as many jumping jacks as possible or follow specific variations.","Endurance; Coordination; Rhythm","None","Open space","High","Enhances cardiovascular fitness and coordination","Physical Fitness Games"
"328","Frisbee Golf","Disc Golf","Outdoor Game","Beginner to Intermediate","Players throw a frisbee towards a target, aiming to complete each hole in the fewest throws possible.","Unlimited","8+","1-2 hours","Frisbees; Targets or designated 'holes'","Complete the course with the fewest number of throws.","Throwing accuracy; Strategy; Endurance","5 minutes","Park or open area","Moderate","Combines physical activity with strategic planning","Physical Fitness Games"
"329","Sack Race","Gunny Sack Race","Running Game","Beginner","Participants race by hopping forward while standing inside a sack or pillowcase.","Unlimited","4+","Variable","Sacks or pillowcases","Reach the finish line first while hopping in the sack.","Balance; Coordination; Leg strength","5 minutes","Flat surface","Moderate","Enhances leg strength and coordination","Physical Fitness Games"
"330","Fitness Bingo","None","Exercise Game","Beginner","Participants complete exercises listed on a bingo card, aiming to complete a row, column, or full card.","Unlimited","6+","Variable","Customized bingo cards; Pens","Complete exercises to achieve bingo patterns on the card.","Strength; Endurance; Flexibility","5 minutes","Open space","Moderate to High","Encourages a variety of exercises and tracks progress","Physical Fitness Games"
"331","Parachute Games","None","Group Activity","Beginner","Participants hold the edges of a large parachute, performing various movements like lifting it up and down or creating waves.","Unlimited","3+","Variable","Play parachute","Engage in group activities that require coordination.","Teamwork; Coordination; Upper body strength","2 minutes","Open area","Low to Moderate","Enhances teamwork and physical coordination","Physical Fitness Games"
"332","Circuit Training","None","Fitness Routine","Intermediate","Participants move through a series of exercise stations targeting different muscle groups with minimal rest between stations.","Unlimited","12+","Variable","Exercise equipment (optional)","Complete all stations efficiently and with proper form.","Strength; Endurance; Flexibility","10 minutes","Gym or open area","High","Provides a full-body workout and improves overall fitness","Physical Fitness Games"
"333","Ultimate Frisbee","None","Team Sport","Intermediate","A non-contact team sport where players aim to score points by passing a frisbee to teammates into the opposing end zone.","14","10+","1 hour","Frisbee; Marked field","Score more points than the opposing team by successfully passing the frisbee into the end zone.","Teamwork; Agility; Throwing skills","10 minutes","Field or open area","High","Enhances cardiovascular fitness and teamwork","Physical Fitness Games"
"334","Jumping Relay","None","Team Game","Beginner","Teams compete in relay races where participants perform jumping movements like frog jumps or hopping on one foot.","Unlimited","6+","Variable","None","Be the first team to have all members complete their jumping segments.","Leg strength; Coordination; Endurance","2 minutes","Open area","Moderate to High","Improves leg strength and coordination","Physical Fitness Games"
"335","Balance Beam Challenges","None","Gymnastics Activity","Beginner","Participants perform movements or poses while balancing on a low beam or taped line on the floor.","Unlimited","5+","Variable","Balance beam or tape to mark a line","Complete balance tasks without stepping off the beam or line.","Balance; Concentration; Coordination","5 minutes","Open area","Low to Moderate","Enhances balance and focus","Physical Fitness Games"
"336","Fitness Monopoly","None","Exercise Game","Beginner to Intermediate","A game where each space on a Monopoly-style board corresponds to a fitness challenge or exercise.","Unlimited","8+","Variable","Customized game board; Dice; Tokens","Complete exercises as you land on spaces to 'purchase' properties.","Strength; Endurance; Flexibility","10 minutes","Open area","Moderate to High","Makes fitness fun by incorporating game elements","Physical Fitness Games"
"337","Hide and Seek","None","Outdoor Game","Beginner","One player closes their eyes and counts while others hide; the seeker then tries to find all hidden players.","Unlimited","3+","Variable","None","Find all hidden players or avoid being found by the seeker.","Observation; Patience; Strategy","None","Various","Moderate","Develops observation skills and strategic thinking","Children Games"
"338","Tag","None","Outdoor Game","Beginner","One player is 'it' and chases others to tag them; the tagged player becomes the new 'it.'","Unlimited","3+","Variable","None","Avoid being tagged or tag other players.","Speed; Agility; Reflexes","None","Open area","High","Promotes physical activity and social interaction","Children Games"
"339","Duck Duck Goose","None","Circle Game","Beginner","Children sit in a circle; one walks around tapping others saying 'duck,' then 'goose' to initiate a chase.","Unlimited","Unknown","15-20 minutes","None","Catch the player before they take your spot or avoid being caught.","Speed; Listening; Reflexes","None","Open area","Moderate","Enhances listening skills and physical activity","Children Games"
"340","Simon Says","None","Instructional Game","Beginner","One player (Simon) gives commands starting with 'Simon says'; players follow only these commands.","Unlimited","3+","Variable","None","Follow only the commands that start with 'Simon says.'","Listening; Attention; Quick thinking","None","Open space","Low","Improves listening skills and impulse control","Children Games"
"341","Musical Chairs","None","Elimination Game","Beginner","Players walk around chairs while music plays; when it stops, they must sit; one chair is removed each round.","Unlimited","4+","Variable","Chairs; Music source","Avoid being left without a chair when the music stops.","Reflexes; Listening; Speed","5 minutes","Open space","Moderate","Develops quick reactions and listening skills","Children Games"
