"gameId","gameName","alternateNames","subcategory","level","description","playersMax","ageRange","duration","equipmentNeeded","objective","skillsDeveloped","setupTime","place","physicalIntensityLevel","educationalBenefits","category"
"463","Takenoko","None","Strategy Board Game","Beginner to Intermediate","Players cultivate land plots, irrigate them, and grow bamboo while caring for a panda.","4","8+","45 minutes","Takenoko game set","Score the most points by completing objectives related to gardening and feeding the panda.","Strategic planning; Resource management; Environmental concepts","5 minutes","Tabletop","Low","Encourages strategic thinking and introduces environmental concepts","Board Games"
"464","Forbidden Desert","None","Cooperative Board Game","Intermediate","Players work together to recover a legendary flying machine buried in a desert storm.","5","10+","45 minutes","Forbidden Desert game set","Find all parts of the flying machine and escape before perishing.","Teamwork; Strategic planning; Problem-solving","5 minutes","Tabletop","Low","Enhances cooperative skills and strategic thinking","Board Games"
"465","Mysterium","None","Cooperative Deduction Game","Intermediate","One player is a ghost who sends visions to mediums to solve a murder mystery.","7","10+","42 minutes","Mysterium game set","Correctly identify the culprit, location, and weapon with the ghost's clues.","Deduction; Communication; Interpretation","5 minutes","Tabletop","Low","Improves deductive reasoning and teamwork","Party Games"
"466","Spyfall 2","None","Social Deduction Game","Beginner to Intermediate","An expanded version of Spyfall with more locations and up to 12 players.","12","13+","15 minutes per round","Spyfall 2 cards or app","Identify the spy or, as the spy, guess the location.","Deductive reasoning; Bluffing; Communication","2 minutes","Tabletop","Low","Enhances deductive reasoning and social interaction","Party Games"
"467","Galaxy Trucker","None","Strategy Board Game","Intermediate","Players build spaceships in real-time from available components and then navigate them through hazards.","4","10+","60 minutes","Galaxy Trucker game set","Accumulate the most credits by successfully delivering goods and surviving the journey.","Strategic planning; Time management; Risk assessment","5 minutes","Tabletop","Low","Develops strategic thinking and time management skills","Board Games"
"468","Imhotep","None","Strategy Board Game","Beginner to Intermediate","Players become builders in ancient Egypt, transporting stones to various construction sites.","4","10+","40 minutes","Imhotep game set","Score the most points by contributing to monumental structures.","Strategic planning; Resource management; Timing","5 minutes","Tabletop","Low","Enhances strategic planning and timing skills","Board Games"
"469","Karuba","None","Tile-Laying Game","Beginner to Intermediate","Players lead adventurers through the jungle to find hidden temples by placing tiles strategically.","4","8+","40 minutes","Karuba game set","Score the most points by guiding adventurers to temples and collecting treasures.","Strategic planning; Spatial reasoning; Problem-solving","2 minutes","Tabletop","Low","Develops spatial reasoning and strategic thinking","Board Games"
"470","Catan (Germany)","Settlers of Catan","Strategy Board Game","Beginner to Intermediate","Players collect and trade resources to build settlements, cities, and roads to earn victory points on the island of Catan.","4","10+","60-90 minutes","Catan game set","Be the first to reach the required number of victory points by building and trading.","Strategic thinking; Resource management; Negotiation","5 minutes","Tabletop","Low","Enhances strategic planning and negotiation skills","Board Games"
"471","Pandemic","None","Cooperative Board Game","Intermediate","Players work together as a team of specialists to treat infections around the world while gathering resources for cures.","4","8+","45-60 minutes","Pandemic game set","Cure all diseases before they overwhelm the world.","Teamwork; Strategic planning; Problem-solving","5 minutes","Tabletop","Low","Enhances teamwork and cooperative problem-solving","Board Games"
"472","Portal","None","Puzzle Video Game","Intermediate","A first-person puzzle-platform game where players solve puzzles using a portal gun to create linked portals on flat planes.","1","13+","4-6 hours","Computer or console; Game software","Navigate through test chambers using portals to reach the exit.","Problem-solving; Spatial reasoning; Critical thinking","2 minutes","Home gaming setup","Low","Develops problem-solving and spatial reasoning skills","Video Games"
"473","Dungeons & Dragons (USA)","D&D","Role-Playing Game","Beginner to Advanced","A tabletop role-playing game where players create characters and embark on imaginary adventures within a fantasy setting.","Unlimited","12+","Variable","Rulebooks; Dice; Character sheets","Collaboratively tell a story and overcome challenges set by the Dungeon Master.","Creativity; Teamwork; Problem-solving","15 minutes","Tabletop","Low","Enhances creativity, storytelling, and social skills","Role-Playing Games"
"474","Coding Unplugged Activities","None","Educational Game","Beginner","Offline activities that teach basic coding concepts without the use of computers, using physical objects and interactive tasks.","Unlimited","6+","Variable","Paper; Pens; Physical objects","Understand programming logic and concepts through interactive activities.","Logical thinking; Sequencing; Problem-solving","5 minutes","Classroom or open area","Low","Introduces coding concepts in an accessible way","Educational Games"
"475","Pictionary Air","None","Drawing Game","Beginner","A modern twist on Pictionary where players draw in the air using a special pen and see their drawings on a screen via a smartphone app.","Unlimited","8+","Variable","Pictionary Air pen; Smartphone or tablet","Get your team to guess the word or phrase you're drawing in the air.","Creativity; Visual communication; Teamwork","5 minutes","Living room or open space","Low","Encourages creativity and visual expression","Party Games"
"476","Karaoke Night","None","Music Game","Beginner","Participants sing along to music videos with lyrics displayed on a screen, either solo or in groups.","Unlimited","All ages","Variable","Microphone; Karaoke machine or app","Enjoy singing songs and entertaining others.","Confidence; Public speaking; Creativity","5 minutes","Home or venue","Low","Enhances confidence and provides social entertainment","Party Games"
"477","Blindfold Taste Test","None","Team-Building Activity","Beginner","Participants are blindfolded and try to guess various foods by taste, fostering trust and sensory awareness.","Unlimited","8+","Variable","Blindfolds; Variety of foods","Correctly identify the foods being tasted.","Sensory awareness; Communication; Trust","5 minutes","Kitchen or dining area","Low","Enhances sensory perception and trust among team members","Team-Building Games"
"478","Egg and Spoon Race","None","Outdoor Game","Beginner","Participants race while balancing an egg on a spoon, aiming to reach the finish line without dropping the egg.","Unlimited","5+","Variable","Eggs (or substitutes); Spoons","Reach the finish line first without dropping the egg.","Balance; Coordination; Concentration","2 minutes","Flat surface","Moderate","Improves balance and coordination","Children's Games"
"479","Molkky (Finland)","Finnish Skittles","Outdoor Game","Beginner","A lawn game where players knock down numbered wooden pins by tossing a wooden pin at them, aiming to reach exactly 50 points.","Unlimited","6+","Variable","Mlkky game set","Reach exactly 50 points by knocking down pins.","Throwing accuracy; Math skills; Strategy","5 minutes","Grass or flat surface","Low to Moderate","Develops coordination and basic arithmetic","Traditional and Cultural Games"
"480","Monopoly","None","Family Board Game","Beginner to Intermediate","A board game where players roll dice to move around the board, buying and trading properties, and collecting rent.","8","8+","1-3 hours","Monopoly board; Tokens; Title Deed cards; Chance cards; Community Chest cards; Houses and Hotels; Money; Dice","Become the wealthiest player through buying, renting, and selling property.","Financial literacy; Negotiation; Strategic planning","5-10 minutes","Tabletop","Low","Teaches basic financial concepts and strategic decision-making","Board Games"
"481","Scrabble","None","Word Game","Beginner to Advanced","A word game where players score points by placing tiles bearing a single letter onto a game board.","4","10+","50 minutes","Scrabble board; Letter tiles; Tile racks","Score the most points by creating words on the board.","Vocabulary; Spelling; Strategic placement","5 minutes","Tabletop","Low","Enhances vocabulary and spelling skills","Board Games"
"482","Risk","None","Strategy Board Game","Intermediate to Advanced","A strategy game of diplomacy and conquest where players control armies to conquer territories.","6","10+","2-4 hours","Risk game board; Army tokens; Dice; Cards","Conquer all territories on the board.","Strategic planning; Negotiation; Risk assessment","10 minutes","Tabletop","Low","Develops strategic thinking and negotiation skills","Board Games"
"483","Settlers of Catan","Catan","Strategy Board Game","Intermediate","Players collect resources and build settlements to earn victory points.","4","10+","1-2 hours","Catan game board; Resource cards; Tokens; Dice","Be the first to reach a set number of victory points.","Resource management; Strategy; Negotiation","10 minutes","Tabletop","Low","Enhances strategic planning and resource management skills","Board Games"
"484","Ticket to Ride","None","Strategy Board Game","Beginner to Intermediate","A cross-country train adventure where players collect and play matching train cards to claim railway routes.","5","8+","30-60 minutes","Game board; Train cards; Destination tickets; Train pieces","Score the most points by claiming routes and completing destination tickets.","Strategic planning; Risk assessment; Route planning","5 minutes","Tabletop","Low","Enhances strategic thinking and planning skills","Board Games"
"485","Clue","Cluedo","Mystery Board Game","Beginner to Intermediate","Players move around a mansion to solve a murder by deducing the correct suspect, weapon, and room.","6","8+","45-60 minutes","Clue board; Character tokens; Weapon tokens; Cards; Notepad; Dice","Be the first to correctly identify the murderer, weapon, and location.","Deductive reasoning; Memory; Strategy","5 minutes","Tabletop","Low","Improves logical thinking and deductive skills","Board Games"
"486","Connect Four","Four in a Row","Abstract Strategy Game","Beginner","Players take turns dropping colored discs into a grid to make a line of four.","2","6+","10-20 minutes","Connect Four grid; Colored discs","Be the first to connect four of your colored discs in a row.","Strategic planning; Pattern recognition; Problem-solving","2 minutes","Tabletop","Low","Develops critical thinking and planning skills","Board Games"
"487","Sorry!","None","Family Board Game","Beginner","Players move their pawns around the board with the goal of getting all their pawns home while sending others back to start.","4","6+","30 minutes","Game board; Pawns; Cards","Be the first to get all your pawns to the home space.","Counting; Strategy; Social interaction","5 minutes","Tabletop","Low","Encourages strategic thinking and social skills","Board Games"
"488","Candy Land","None","Children's Board Game","Beginner","A simple racing game where players move their pawn according to drawn cards through a colorful candy-themed path.","4","3+","15-20 minutes","Game board; Color cards; Pawns","Reach the Candy Castle at the end of the path first.","Color recognition; Counting; Patience","2 minutes","Tabletop","Low","Helps young children with color recognition and following directions","Board Games"
"489","Guess Who?","None","Deduction Game","Beginner","Players ask yes or no questions to eliminate characters and guess the opponent's chosen character.","2","6+","15 minutes","Guess Who? game boards; Character cards","Be the first to correctly guess the opponent's character.","Deductive reasoning; Observation; Questioning","2 minutes","Tabletop","Low","Develops deductive reasoning and questioning skills","Board Games"
"490","Stratego","None","Strategy Board Game","Intermediate","Players command an army of pieces with hidden values and attempt to capture the opponent's flag.","2","8+","45 minutes","Stratego game board; Army pieces; Flag","Capture the opponent's flag or eliminate all their movable pieces.","Strategic planning; Memory; Deduction","10 minutes","Tabletop","Low","Enhances strategic thinking and memory skills","Board Games"
"491","Trouble","Frustration","Family Board Game","Beginner","Players race to move all their pieces around the board to the finish, using the Pop-O-Matic die roller.","4","5+","30 minutes","Game board with Pop-O-Matic die; Pawns","Be the first to get all your pieces to the finish line.","Counting; Strategy; Patience","2 minutes","Tabletop","Low","Helps with counting and turn-taking","Board Games"
"492","Othello","Reversi","Abstract Strategy Game","Beginner to Intermediate","A two-player game where the goal is to have the majority of discs turned to display your color at the end of the game.","2","8+","30 minutes","Othello game board; Black and white discs","Have more discs of your color on the board than your opponent by the end of the game.","Strategic planning; Spatial reasoning; Foresight","2 minutes","Tabletop","Low","Develops strategic thinking and planning skills","Board Games"
"493","Sequence","None","Strategy Card Game","Beginner to Intermediate","Players use cards to place chips on a game board, aiming to create rows of five chips.","12","7+","30 minutes","Sequence game board; Playing cards; Chips","Be the first to create the required number of sequences (rows of five).","Strategic planning; Probability; Teamwork","5 minutes","Tabletop","Low","Enhances strategic thinking and probability assessment","Board Games"
"494","Blokus","None","Abstract Strategy Game","Beginner to Intermediate","Players take turns placing pieces on the board, with the goal of placing as many of their pieces as possible.","4","7+","20-30 minutes","Blokus game board; Colored pieces","Place all your pieces on the board while blocking opponents.","Spatial reasoning; Strategic planning; Problem-solving","2 minutes","Tabletop","Low","Develops spatial reasoning and strategic planning","Board Games"
"495","Go","None","Classic Strategy","Beginner to Professional","An abstract strategy board game for two players in which the aim is to surround more territory than the opponent.","2","8+","30 minutes to several hours","Go board; Black and white stones","Control more territory on the board than the opponent by placing stones strategically.","Strategic thinking; Patience; Spatial reasoning","5 minutes","Tabletop","Low","Enhances strategic thinking, patience, and spatial reasoning","Board Games"
"496","Backgammon","None","Classic Strategy","Intermediate","A two-player game combining strategy and luck where players move pieces according to the roll of dice.","2","10+","30-60 minutes","Backgammon board; Checkers; Dice","Move all your checkers off the board before your opponent.","Strategic planning; Probability; Counting","5 minutes","Tabletop","Low","Enhances strategic thinking and probability assessment","Board Games"
"497","The Game of Life","None","Family Game","Beginner","Players navigate life events from college to retirement, making choices that affect their wealth and happiness.","6","8+","1 hour","Game board; Spinner; Cars; Pegs; Cards; Money","Accumulate wealth and happiness to win the game.","Decision-making; Financial literacy; Risk assessment","10 minutes","Tabletop","Low","Introduces life choices and consequences in a fun way","Board Games"
"498","Pandemic","None","Cooperative Game","Intermediate","Players work together to stop global pandemics by treating diseases and finding cures.","4","8+","45 minutes","Game board; Role cards; Player cards; Disease cubes; Tokens","Work cooperatively to discover cures for all diseases before outbreaks overwhelm the world.","Teamwork; Strategic planning; Problem-solving","10 minutes","Tabletop","Low","Enhances cooperative skills and strategic thinking","Board Games"
"499","Forbidden Island","None","Cooperative Game","Beginner to Intermediate","A cooperative game where players work together to retrieve treasures from a sinking island.","4","10+","30 minutes","Tiles; Treasure figurines; Adventurer cards; Flood cards; Pawns","Collect all the treasures and escape the island before it sinks.","Teamwork; Strategic planning; Risk management","5 minutes","Tabletop","Low","Promotes teamwork and strategic thinking","Board Games"
"500","Gloomhaven","None","Cooperative Game","Advanced","A cooperative campaign-driven tactical combat game set in a fantasy world.","4","14+","1-2 hours per scenario","Game board; Character cards; Miniatures; Tokens; Scenario book","Work together to complete scenarios and progress through the story.","Strategic planning; Cooperation; Problem-solving","20-30 minutes","Tabletop","Low","Enhances cooperative skills and complex strategic thinking","Board Games"
"501","Axis & Allies","None","Strategy and War Game","Intermediate to Advanced","A strategy board game depicting World War II, where players command military forces to achieve victory.","5","12+","2-4 hours","Game board; Army pieces; Cards; Dice; Tokens","Achieve victory through military conquest, economic control, and strategic alliances.","Strategic planning; Resource management; Diplomacy","15 minutes","Tabletop","Low","Develops strategic thinking, historical awareness, and negotiation skills","Board Games"
"502","Azul","None","Abstract Game","Beginner to Intermediate","Players take turns drafting colored tiles to decorate their palace in a strategic pattern.","4","8+","30-45 minutes","Azul game board; Tiles; Scoring markers","Score the most points by placing tiles strategically on your board.","Strategic planning; Pattern recognition; Resource management","5 minutes","Tabletop","Low","Enhances strategic thinking and pattern recognition","Board Games"
"503","Qwirkle","None","Abstract Game","Beginner to Intermediate","Players match tiles based on color or shape to score points.","4","6+","30-45 minutes","Qwirkle tiles","Score the most points by creating lines of matching shapes or colors.","Pattern recognition; Strategic planning; Problem-solving","2 minutes","Tabletop","Low","Enhances pattern recognition and strategic thinking","Board Games"
"504","Scrabble","None","Word Game","Beginner to Advanced","Players create words on a game board using lettered tiles, earning points based on the letters used.","4","8+","50 minutes","Scrabble game set","Score the most points by creating high-scoring words.","Vocabulary; Spelling; Strategic thinking","5 minutes","Tabletop","Low","Enhances vocabulary and strategic planning","Board Games"
"505","Monopoly","None","Economic Strategy Game","Beginner to Intermediate","Players buy, sell, and trade properties to bankrupt opponents and monopolize the board.","8","8+","1-3 hours","Monopoly game set","Be the last player remaining with money.","Financial literacy; Negotiation; Strategic thinking","5 minutes","Tabletop","Low","Teaches money management and strategic planning","Board Games"
"506","Chess","International Chess; Western Chess","Strategy Board Game","Beginner to Grandmaster","A two-player game of strategic skill played on a checkered board, aiming to checkmate the opponent's king.","2","6+","10 minutes to several hours","Chessboard; 32 chess pieces","Checkmate the opponent's king.","Strategic thinking; Planning; Concentration","Under 5 minutes","Tabletop","Low","Develops logical reasoning and strategic planning","Board Games"
"507","Checkers","Draughts","Strategy Board Game","Beginner to Intermediate","A two-player game where opponents move disc-shaped pieces diagonally to capture the opponent's pieces.","2","6+","20-60 minutes","Checkers board; Pieces","Eliminate all of the opponent's pieces or block them from moving.","Strategic thinking; Planning; Concentration","Under 5 minutes","Tabletop","Low","Enhances strategic planning and foresight","Board Games"
"508","Backgammon","None","Strategy Board Game","Beginner to Advanced","A two-player game combining strategy and luck, where players move pieces according to dice rolls.","2","8+","30-60 minutes","Backgammon board; Checkers; Dice","Be the first to remove all your pieces from the board.","Strategic thinking; Probability; Risk management","Under 5 minutes","Tabletop","Low","Improves strategic thinking and understanding of probability","Board Games"
"509","Risk","None","Strategy Board Game","Intermediate to Advanced","Players control armies to conquer territories and eliminate opponents to achieve world domination.","6","10+","2-4 hours","Risk game set","Conquer all territories on the board.","Strategic planning; Negotiation; Risk assessment","10 minutes","Tabletop","Low","Enhances strategic thinking and global awareness","Board Games"
"510","The Game of Life","None","Family Board Game","Beginner","Players navigate through life events, making choices about career, family, and finances.","6","8+","1 hour","The Game of Life board game","Accumulate the most wealth by the end of the game.","Decision-making; Financial literacy; Planning","5 minutes","Tabletop","Low","Teaches life choices and consequences","Board Games"
"511","Uno","None","Card Game","Beginner","Players take turns matching a card in their hand with the current card shown on top of the deck by color or number.","10","7+","30 minutes","Uno card deck","Be the first to play all your cards.","Color recognition; Number matching; Strategic thinking","Under 2 minutes","Tabletop","Low","Improves matching skills and strategic thinking","Card Games"
"512","Go Fish","None","Card Game","Beginner","Players collect sets of four cards of the same rank by asking other players for cards and drawing from the pool.","6","4+","15-30 minutes","Standard deck of cards","Collect the most sets of four matching cards.","Memory; Probability; Social interaction","Under 2 minutes","Tabletop","Low","Enhances memory and social skills","Children's Games"
"513","Pictionary","None","Drawing Game","Beginner","Players draw clues for their teammates to guess specific words or phrases within a time limit.","Unlimited","8+","Variable","Pictionary game set; Drawing pad; Timer","Be the first team to reach the end of the game board by correctly guessing drawings.","Creativity; Visual communication; Teamwork","5 minutes","Tabletop or open space","Low","Encourages creativity and visual expression","Party Games"
"514","Taboo","None","Word Game","Beginner to Intermediate","Players describe a word to their teammates without using the word itself or five additional forbidden words.","10","12+","Variable","Taboo game cards; Timer; Buzzer","Score points by correctly guessing words without using forbidden terms.","Vocabulary; Quick thinking; Communication","2 minutes","Tabletop","Low","Enhances vocabulary and creative communication","Party Games"
"515","Boggle","None","Word Game","Beginner to Intermediate","Players search for words in sequences of adjacent letters on a grid within a time limit.","8","8+","10 minutes per round","Boggle letter grid; Timer","Find more words than your opponents in the allotted time.","Vocabulary; Spelling; Pattern recognition","1 minute","Tabletop","Low","Improves vocabulary and quick thinking","Mind Games"
"516","Tic-Tac-Toe","Noughts and Crosses","Paper-and-Pencil Game","Beginner","Players take turns marking spaces in a 3x3 grid with X or O, aiming to place three marks in a row.","2","4+","5 minutes","Paper; Pencil","Be the first to get three of your marks in a row.","Strategic thinking; Planning; Pattern recognition","Under 1 minute","Anywhere","Low","Develops strategic thinking and planning","Children's Games"
"517","Mahjong (China)","None","Tile Game","Intermediate to Advanced","A game of skill, strategy, and calculation involving a set of 144 tiles based on Chinese characters and symbols.","4","12+","2-3 hours","Mahjong tiles; Scoring sticks","Be the first to complete a legal hand by drawing and discarding tiles.","Pattern recognition; Memory; Strategic thinking","10 minutes","Tabletop","Low","Enhances memory and strategic planning","Traditional and Cultural Games"
"518","Tetris","None","Puzzle Video Game","Beginner to Advanced","Players manipulate falling tetrominoes to create horizontal lines without gaps, which then disappear.","1","6+","Variable","Computer or gaming device; Game software","Score points by clearing lines and preventing the blocks from reaching the top.","Spatial reasoning; Quick thinking; Problem-solving","None","Home gaming setup","Low","Develops spatial awareness and problem-solving skills","Video Games"
"519","Candy Land","None","Board Game","Beginner","Players race to reach the Candy Castle by drawing colored cards to advance along the path.","4","3+","15-30 minutes","Candy Land game set","Be the first to reach the Candy Castle.","Color recognition; Patience; Turn-taking","2 minutes","Tabletop","Low","Introduces board game mechanics to young children","Children's Games"
"520","Operation","None","Skill Game","Beginner","Players remove various ailments from a patient on the game board without touching the sides of the cavities.","6","6+","15 minutes","Operation game set","Remove all ailments without triggering the buzzer.","Fine motor skills; Hand-eye coordination; Concentration","2 minutes","Tabletop","Low","Improves fine motor skills and concentration","Children's Games"
