"gameId","gameName","alternateNames","subcategory","level","description","playersMax","ageRange","duration","equipmentNeeded","objective","skillsDeveloped","setupTime","place","physicalIntensityLevel","educationalBenefits","category"
"118","Risk","None","Strategy Board Game","Intermediate to Advanced","A strategy game of diplomacy and conquest where players control armies to conquer territories.","6","10+","2-4 hours","Risk game board; Army tokens; Dice; Cards","Conquer all territories on the board.","Strategic planning; Negotiation; Risk assessment","10 minutes","Tabletop","Low","Develops strategic thinking and negotiation skills","Card Games"
"119","Settlers of Catan","Catan","Strategy Board Game","Intermediate","Players collect resources and build settlements to earn victory points.","4","10+","1-2 hours","Catan game board; Resource cards; Tokens; Dice","Be the first to reach a set number of victory points.","Resource management; Strategy; Negotiation","10 minutes","Tabletop","Low","Enhances strategic planning and resource management skills","Card Games"
"120","Ticket to Ride","None","Strategy Board Game","Beginner to Intermediate","A cross-country train adventure where players collect and play matching train cards to claim railway routes.","5","8+","30-60 minutes","Game board; Train cards; Destination tickets; Train pieces","Score the most points by claiming routes and completing destination tickets.","Strategic planning; Risk assessment; Route planning","5 minutes","Tabletop","Low","Enhances strategic thinking and planning skills","Card Games"
"121","Carcassonne","None","Tile-Laying Game","Beginner to Intermediate","Players draw and place tiles to build a medieval landscape and place followers to score points.","5","8+","30-45 minutes","Carcassonne tiles; Meeples (followers); Scoreboard","Score the most points by building cities, roads, monasteries, and farms.","Spatial awareness; Strategic planning; Risk management","5 minutes","Tabletop","Low","Develops spatial reasoning and strategic thinking","Card Games"
"122","Pandemic","None","Cooperative Board Game","Intermediate","Players work together to stop global pandemics by treating diseases and finding cures.","4","8+","45 minutes","Game board; Role cards; Player cards; Disease cubes; Tokens","Work cooperatively to discover cures for all diseases before outbreaks overwhelm the world.","Teamwork; Strategic planning; Problem-solving","10 minutes","Tabletop","Low","Enhances cooperative skills and strategic thinking","Card Games"
"123","Clue","Cluedo","Mystery Board Game","Beginner to Intermediate","Players move around a mansion to solve a murder by deducing the correct suspect, weapon, and room.","6","8+","45-60 minutes","Clue board; Character tokens; Weapon tokens; Cards; Notepad; Dice","Be the first to correctly identify the murderer, weapon, and location.","Deductive reasoning; Memory; Strategy","5 minutes","Tabletop","Low","Improves logical thinking and deductive skills","Card Games"
"124","Battleship","None","Strategy Board Game","Beginner","Players hide ships on a grid and take turns guessing the coordinates to sink each other's fleet.","2","7+","20-30 minutes","Battleship game boards; Ships; Pegs","Sink all of the opponent's ships before they sink yours.","Strategic thinking; Memory; Deduction","5 minutes","Tabletop","Low","Enhances strategic planning and spatial reasoning","Card Games"
"125","Connect Four","Four in a Row","Abstract Strategy Game","Beginner","Players take turns dropping colored discs into a grid to make a line of four.","2","6+","10-20 minutes","Connect Four grid; Colored discs","Be the first to connect four of your colored discs in a row.","Strategic planning; Pattern recognition; Problem-solving","2 minutes","Tabletop","Low","Develops critical thinking and planning skills","Card Games"
"126","The Game of Life","None","Family Board Game","Beginner","Players navigate life events from college to retirement, making choices that affect their wealth and happiness.","6","8+","1 hour","Game board; Spinner; Cars; Pegs; Cards; Money","Accumulate wealth and happiness to win the game.","Decision-making; Financial literacy; Risk assessment","10 minutes","Tabletop","Low","Introduces life choices and consequences in a fun way","Card Games"
"127","Sorry!","None","Family Board Game","Beginner","Players move their pawns around the board with the goal of getting all their pawns home while sending others back to start.","4","6+","30 minutes","Game board; Pawns; Cards","Be the first to get all your pawns to the home space.","Counting; Strategy; Social interaction","5 minutes","Tabletop","Low","Encourages strategic thinking and social skills","Card Games"
"128","Candy Land","None","Children's Board Game","Beginner","A simple racing game where players move their pawn according to drawn cards through a colorful candy-themed path.","4","3+","15-20 minutes","Game board; Color cards; Pawns","Reach the Candy Castle at the end of the path first.","Color recognition; Counting; Patience","2 minutes","Tabletop","Low","Helps young children with color recognition and following directions","Card Games"
"129","Guess Who?","None","Deduction Game","Beginner","Players ask yes or no questions to eliminate characters and guess the opponent's chosen character.","2","6+","15 minutes","Guess Who? game boards; Character cards","Be the first to correctly guess the opponent's character.","Deductive reasoning; Observation; Questioning","2 minutes","Tabletop","Low","Develops deductive reasoning and questioning skills","Card Games"
"130","Stratego","None","Strategy Board Game","Intermediate","Players command an army of pieces with hidden values and attempt to capture the opponent's flag.","2","8+","45 minutes","Stratego game board; Army pieces; Flag","Capture the opponent's flag or eliminate all their movable pieces.","Strategic planning; Memory; Deduction","10 minutes","Tabletop","Low","Enhances strategic thinking and memory skills","Card Games"
"131","Trouble","Frustration","Family Board Game","Beginner","Players race to move all their pieces around the board to the finish, using the Pop-O-Matic die roller.","4","5+","30 minutes","Game board with Pop-O-Matic die; Pawns","Be the first to get all your pieces to the finish line.","Counting; Strategy; Patience","2 minutes","Tabletop","Low","Helps with counting and turn-taking","Card Games"
"132","Othello","Reversi","Abstract Strategy Game","Beginner to Intermediate","A two-player game where the goal is to have the majority of discs turned to display your color at the end of the game.","2","8+","30 minutes","Othello game board; Black and white discs","Have more discs of your color on the board than your opponent by the end of the game.","Strategic planning; Spatial reasoning; Foresight","2 minutes","Tabletop","Low","Develops strategic thinking and planning skills","Card Games"
"133","Sequence","None","Strategy Card Game","Beginner to Intermediate","Players use cards to place chips on a game board, aiming to create rows of five chips.","12","7+","30 minutes","Sequence game board; Playing cards; Chips","Be the first to create the required number of sequences (rows of five).","Strategic planning; Probability; Teamwork","5 minutes","Tabletop","Low","Enhances strategic thinking and probability assessment","Card Games"
"134","Azul","None","Abstract Strategy Game","Beginner to Intermediate","Players take turns drafting colored tiles to decorate their palace in a strategic pattern.","4","8+","30-45 minutes","Azul game board; Tiles; Scoring markers","Score the most points by placing tiles strategically on your board.","Strategic planning; Pattern recognition; Resource management","5 minutes","Tabletop","Low","Enhances strategic thinking and pattern recognition","Card Games"
"135","Chess","International Chess; Western Chess","Classic Strategy","Beginner to Grandmaster","A strategic two-player game involving tactical moves to checkmate the opponent's king.","2","6+","10 minutes to several hours","Chessboard; 32 chess pieces","Checkmate the opponent's king.","Critical thinking; Problem-solving; Concentration","Under 5 minutes","Tabletop","Low","Improves logical reasoning and strategic planning","Card Games"
"136","Checkers","Draughts","Classic Strategy","Beginner","A strategy game where players move pieces diagonally to capture opponent pieces by jumping over them.","2","6+","10-30 minutes","Checkers board; 24 playing pieces","Capture all of the opponent's pieces or block them from moving.","Strategic planning; Forward thinking; Patience","2 minutes","Tabletop","Low","Develops strategic thinking and planning skills","Card Games"
"137","Go","None","Classic Strategy","Beginner to Professional","An abstract strategy board game for two players in which the aim is to surround more territory than the opponent.","2","8+","30 minutes to several hours","Go board; Black and white stones","Control more territory on the board than the opponent by placing stones strategically.","Strategic thinking; Patience; Spatial reasoning","5 minutes","Tabletop","Low","Enhances strategic thinking, patience, and spatial reasoning","Card Games"
"138","Backgammon","None","Classic Strategy","Intermediate","A two-player game combining strategy and luck where players move pieces according to the roll of dice.","2","10+","30-60 minutes","Backgammon board; Checkers; Dice","Move all your checkers off the board before your opponent.","Strategic planning; Probability; Counting","5 minutes","Tabletop","Low","Enhances strategic thinking and probability assessment","Card Games"
"139","Forbidden Island","None","Cooperative Game","Beginner to Intermediate","A cooperative game where players work together to retrieve treasures from a sinking island.","4","10+","30 minutes","Tiles; Treasure figurines; Adventurer cards; Flood cards; Pawns","Collect all the treasures and escape the island before it sinks.","Teamwork; Strategic planning; Risk management","5 minutes","Tabletop","Low","Promotes teamwork and strategic thinking","Card Games"
"140","Gloomhaven","None","Cooperative Game","Advanced","A cooperative campaign-driven tactical combat game set in a fantasy world.","4","14+","1-2 hours per scenario","Game board; Character cards; Miniatures; Tokens; Scenario book","Work together to complete scenarios and progress through the story.","Strategic planning; Cooperation; Problem-solving","20-30 minutes","Tabletop","Low","Enhances cooperative skills and complex strategic thinking","Card Games"
"141","Axis & Allies","None","Strategy and War Game","Intermediate to Advanced","A strategy board game depicting World War II, where players command military forces to achieve victory.","5","12+","2-4 hours","Game board; Army pieces; Cards; Dice; Tokens","Achieve victory through military conquest, economic control, and strategic alliances.","Strategic planning; Resource management; Diplomacy","15 minutes","Tabletop","Low","Develops strategic thinking, historical awareness, and negotiation skills","Card Games"
"142","Blokus","None","Abstract Game","Beginner to Intermediate","Players take turns placing pieces on the board, with the goal of placing as many of their pieces as possible.","4","7+","20-30 minutes","Blokus game board; Colored pieces","Place all your pieces on the board while blocking opponents.","Spatial reasoning; Strategic planning; Problem-solving","2 minutes","Tabletop","Low","Develops spatial reasoning and strategic planning","Card Games"
"143","Qwirkle","None","Abstract Game","Beginner to Intermediate","Players match tiles based on color or shape to score points.","4","6+","30-45 minutes","Qwirkle tiles","Score the most points by creating lines of matching shapes or colors.","Pattern recognition; Strategic planning; Problem-solving","2 minutes","Tabletop","Low","Enhances pattern recognition and strategic thinking","Card Games"
"144","The Legend of Zelda: Breath of the Wild","Zelda BOTW","Action-Adventure","Intermediate","An open-world game where players explore, solve puzzles, and battle enemies in the kingdom of Hyrule.","1","10+","50-200 hours","Nintendo Switch console; Game cartridge or download","Defeat Calamity Ganon to save Hyrule.","Problem-solving; Exploration; Strategic thinking","Installation time (~10 minutes)","Home gaming setup","Low","Enhances critical thinking and problem-solving skills","Video Games"
"145","Minecraft","None","Sandbox","Beginner to Advanced","A game where players build and explore infinite worlds, crafting tools and items to survive and create.","Unlimited (on servers)","7+","Variable","Computer or console; Game software","Survive and build structures in a block-based world.","Creativity; Resource management; Planning","Installation time (~10 minutes)","Home gaming setup","Low","Encourages creativity and basic programming concepts","Video Games"
"146","Fortnite","None","Battle Royale","Beginner to Advanced","A multiplayer game where players build structures and battle to be the last one standing.","100","13+","20-30 minutes per match","Computer or console; Game software","Be the last player or team remaining.","Strategic thinking; Reflexes; Teamwork","Installation time (~10 minutes)","Home gaming setup","Moderate","Improves strategic planning and teamwork","Video Games"
"147","Overwatch","None","First-Person Shooter (FPS)","Intermediate","A team-based shooter game where players choose heroes with unique abilities to complete objectives.","12","13+","10-20 minutes per match","Computer or console; Game software","Work with your team to complete objectives and defeat the opposing team.","Teamwork; Strategic planning; Reflexes","Installation time (~10 minutes)","Home gaming setup","Moderate","Enhances teamwork and strategic thinking","Video Games"
"148","Stardew Valley","None","Simulation RPG","Beginner to Intermediate","A farming simulation game where players manage a farm, interact with townspeople, and explore.","1","10+","50+ hours","Computer or console; Game software","Restore and manage your inherited farm.","Resource management; Planning; Social interaction","Installation time (~10 minutes)","Home gaming setup","Low","Promotes planning and time management skills","Video Games"
"149","Animal Crossing: New Horizons","None","Life Simulation","Beginner","A game where players develop a deserted island into a thriving community, interacting with animal villagers.","1","3+","Variable","Nintendo Switch console; Game cartridge or download","Build and customize your island paradise.","Creativity; Planning; Social interaction","Installation time (~10 minutes)","Home gaming setup","Low","Encourages creativity and social interaction","Video Games"
"150","Call of Duty: Modern Warfare","None","First-Person Shooter (FPS)","Intermediate to Advanced","A military shooter game with both single-player campaigns and multiplayer modes.","150","17+","Variable","Computer or console; Game software","Complete missions and objectives; defeat opposing players in multiplayer.","Reflexes; Strategic thinking; Teamwork","Installation time (~10 minutes)","Home gaming setup","Moderate","Enhances strategic thinking and teamwork","Video Games"
"151","Assassin's Creed Valhalla","None","Action-Adventure RPG","Intermediate","An open-world game set in the Viking era, where players explore and complete quests.","1","17+","60+ hours","Computer or console; Game software","Lead Viking raids and build your settlement.","Strategic planning; Exploration; Problem-solving","Installation time (~10 minutes)","Home gaming setup","Low","Promotes historical interest and strategic thinking","Video Games"
"152","Among Us","None","Social Deduction","Beginner","A multiplayer game where players work together to complete tasks on a spaceship, while impostors try to eliminate them.","15","10+","10-15 minutes per match","Computer or mobile device; Game software","Identify and vote out the impostors or sabotage the crew as an impostor.","Social deduction; Teamwork; Deception","2 minutes","Home gaming setup","Low","Enhances social deduction and teamwork skills","Video Games"
"153","Rocket League","None","Sports","Beginner to Advanced","A game that combines soccer with rocket-powered cars, allowing players to perform aerial stunts.","8","7+","5-10 minutes per match","Computer or console; Game software","Score more goals than the opposing team using rocket-powered cars.","Hand-eye coordination; Teamwork; Reflexes","Installation time (~10 minutes)","Home gaming setup","Moderate","Improves coordination and teamwork","Video Games"
"154","Portal 2","None","Puzzle-Platformer","Intermediate","A game where players solve puzzles by placing portals and teleporting between them.","2","10+","8-10 hours","Computer or console; Game software","Navigate through test chambers using portals to solve puzzles.","Problem-solving; Spatial reasoning; Creativity","Installation time (~10 minutes)","Home gaming setup","Low","Enhances problem-solving and critical thinking skills","Video Games"
"155","The Witcher 3: Wild Hunt","None","Action RPG","Advanced","An open-world role-playing game where players hunt monsters and make choices that affect the story.","1","17+","100+ hours","Computer or console; Game software","Complete quests and make choices that impact the game world.","Strategic thinking; Decision-making; Exploration","Installation time (~10 minutes)","Home gaming setup","Low","Promotes strategic planning and moral decision-making","Video Games"
"156","Mario Kart 8 Deluxe","None","Racing","Beginner to Intermediate","A racing game featuring characters from the Mario franchise, with various tracks and power-ups.","12","3+","5-10 minutes per race","Nintendo Switch console; Game cartridge or download","Finish races in first place using driving skills and power-ups.","Hand-eye coordination; Reflexes; Strategy","2 minutes","Home gaming setup","Moderate","Improves coordination and reaction time","Video Games"
"157","FIFA 22","None","Sports Simulation","Beginner to Advanced","A football (soccer) simulation game featuring real teams and players.","22","3+","Variable","Computer or console; Game software","Win matches and tournaments by scoring more goals than the opponent.","Teamwork; Strategic planning; Reflexes","Installation time (~10 minutes)","Home gaming setup","Moderate","Enhances strategic thinking and understanding of soccer","Video Games"
"158","League of Legends","LoL","Multiplayer Online Battle Arena (MOBA)","Intermediate to Advanced","A competitive game where two teams battle to destroy the other's Nexus (base).","10","13+","30-45 minutes per match","Computer; Game software","Work with your team to destroy the enemy's Nexus.","Teamwork; Strategic planning; Reflexes","Installation time (~10 minutes)","Home gaming setup","Moderate","Develops teamwork and strategic planning skills","Video Games"
"159","Hollow Knight","None","Action-Adventure Metroidvania","Intermediate","A 2D game where players explore a vast underground world, battling creatures and discovering secrets.","1","10+","30-40 hours","Computer or console; Game software","Explore the kingdom of Hallownest and uncover its mysteries.","Exploration; Problem-solving; Precision","Installation time (~10 minutes)","Home gaming setup","Low","Enhances exploration skills and problem-solving","Video Games"
"160","Celeste","None","Platformer","Intermediate","A challenging platformer where players climb a mountain while overcoming obstacles and personal struggles.","1","10+","10-15 hours","Computer or console; Game software","Reach the summit of Celeste Mountain.","Precision; Problem-solving; Perseverance","Installation time (~10 minutes)","Home gaming setup","Low","Promotes perseverance and problem-solving skills","Video Games"
"161","God of War (2018)","None","Action-Adventure","Intermediate to Advanced","Players control Kratos in a journey with his son Atreus through Norse mythology.","1","17+","20-30 hours","PlayStation console; Game software","Complete quests and unravel the story of Kratos and Atreus.","Strategic combat; Exploration; Storytelling","Installation time (~10 minutes)","Home gaming setup","Low","Enhances strategic thinking and cultural interest","Video Games"
"162","Super Smash Bros. Ultimate","None","Fighting","Beginner to Advanced","A crossover fighting game featuring characters from various Nintendo franchises.","8","10+","Variable","Nintendo Switch console; Game cartridge or download","Defeat opponents by knocking them off the stage.","Reflexes; Strategy; Hand-eye coordination","2 minutes","Home gaming setup","Moderate","Improves reflexes and strategic planning","Video Games"
"163","Elden Ring","None","Action RPG","Advanced","An open-world game where players explore and battle through a fantasy realm to restore the Elden Ring.","1","17+","60+ hours","Computer or console; Game software","Defeat bosses and unravel the mysteries of the Elden Ring.","Strategic combat; Exploration; Problem-solving","Installation time (~10 minutes)","Home gaming setup","Low","Enhances strategic thinking and problem-solving","Video Games"
"164","Tetris Effect","None","Puzzle","Beginner to Intermediate","A reinvention of the classic Tetris game with immersive visuals and music.","1","3+","Variable","Computer or console; Game software","Clear lines by strategically placing falling blocks.","Spatial reasoning; Reflexes; Pattern recognition","2 minutes","Home gaming setup","Low","Develops spatial awareness and pattern recognition","Video Games"
"165","Final Fantasy VII Remake","None","Action RPG","Intermediate to Advanced","A reimagined version of the classic RPG, combining real-time action with strategic combat.","1","13+","40+ hours","PlayStation console; Game software","Fight against the Shinra corporation to save the planet.","Strategic combat; Storytelling; Exploration","Installation time (~10 minutes)","Home gaming setup","Low","Enhances strategic thinking and appreciation for storytelling","Video Games"
"166","The Legend of Zelda","None","Action and Adventure","Beginner to Intermediate","An action-adventure game where players control Link on a quest to save Princess Zelda and the kingdom of Hyrule.","1","10+","20+ hours","Nintendo console; Game cartridge or download","Defeat Ganon and rescue Princess Zelda.","Problem-solving; Exploration; Strategic thinking","Minimal","Home gaming setup","Low","Enhances critical thinking and problem-solving skills","Video Games"
"167","Grand Theft Auto V","GTA V","Action and Adventure","Mature","An open-world game where players explore the city of Los Santos, completing missions and engaging in various activities.","30 (online)","17+","Variable","Computer or console; Game software","Complete missions and explore the open world.","Strategic thinking; Decision-making; Reflexes","Installation time (~10 minutes)","Home gaming setup","Low","Enhances strategic thinking and decision-making skills","Video Games"
"168","Assassin's Creed","None","Action and Adventure","Intermediate","An action-adventure game series where players experience historical settings through the memories of assassins.","1","17+","20+ hours per game","Computer or console; Game software","Complete missions and uncover the story of the Assassins and Templars.","Strategic thinking; Stealth; Problem-solving","Installation time (~10 minutes)","Home gaming setup","Low","Promotes historical interest and strategic thinking","Video Games"
"169","Final Fantasy VII","None","Role-Playing Game (RPG)","Intermediate","A role-playing game where players follow Cloud Strife in a quest against the Shinra corporation.","1","13+","40+ hours","Computer or console; Game software","Defeat the antagonists and save the planet.","Strategic combat; Storytelling; Exploration","Installation time (~10 minutes)","Home gaming setup","Low","Enhances strategic thinking and appreciation for storytelling","Video Games"
"170","The Witcher 3: Wild Hunt","None","Role-Playing Game (RPG)","Advanced","An open-world RPG where players control Geralt of Rivia in a quest to find his adopted daughter.","1","17+","100+ hours","Computer or console; Game software","Complete quests and make choices that impact the game world.","Strategic thinking; Decision-making; Exploration","Installation time (~10 minutes)","Home gaming setup","Low","Promotes strategic planning and moral decision-making","Video Games"
"171","The Elder Scrolls V: Skyrim","Skyrim","Role-Playing Game (RPG)","Intermediate to Advanced","An open-world RPG where players explore the land of Skyrim, battling dragons and completing quests.","1","17+","100+ hours","Computer or console; Game software","Defeat Alduin and complete various quests.","Exploration; Strategic thinking; Character development","Installation time (~10 minutes)","Home gaming setup","Low","Enhances exploration skills and strategic planning","Video Games"
"172","Halo: Infinite","None","First-Person Shooter (FPS)","Intermediate","A sci-fi shooter game where players control Master Chief in a battle against alien forces.","24","13+","Variable","Xbox console or PC; Game software","Complete the campaign and engage in multiplayer battles.","Reflexes; Strategic thinking; Teamwork","Installation time (~10 minutes)","Home gaming setup","Moderate","Enhances teamwork and strategic thinking","Video Games"
"173","Counter-Strike: Global Offensive","CS:GO","First-Person Shooter (FPS)","Intermediate to Advanced","A competitive shooter game where teams of terrorists and counter-terrorists compete to complete objectives.","10","17+","30-90 minutes per match","Computer; Game software","Complete objectives or eliminate the opposing team.","Teamwork; Reflexes; Strategic planning","Installation time (~10 minutes)","Home gaming setup","Moderate","Develops teamwork and strategic planning skills","Video Games"
